{
	"$schema": "https://json-schema.org/draft/2020-12/schema",
	"$id": "https://github.com/myersm0/werkverzeichnis/schemas/composer.schema.json",
	"title": "Composer",
	"type": "object",
	"additionalProperties": false,
	"required": ["id", "name"],
	"properties": {
		"id": {
			"type": "string",
			"pattern": "^[a-z]+(-[a-z]+)?$",
			"description": "Slug identifier; bare surname for most famous family member, surname-suffix for others"
		},
		"name": {
			"type": "object",
			"additionalProperties": false,
			"required": ["full", "sort"],
			"properties": {
				"full": {"type": "string"},
				"sort": {"type": "string", "description": "Last, First format"}
			}
		},
		"default_scheme": {
			"type": "string",
			"description": "Catalog scheme used when no scheme is supplied"
		},
		"born": {
			"type": ["string", "null"],
			"format": "date"
		},
		"died": {
			"type": ["string", "null"],
			"format": "date"
		},
		"nationality": {
			"type": ["string", "null"]
		},
		"catalogs": {
			"type": "object",
			"description": "Catalog schemes for this composer, keyed by short identifier",
			"propertyNames": {"pattern": "^[a-z0-9-]+$"},
			"additionalProperties": {"$ref": "#/$defs/catalogDefinition"}
		},
		"xref": {
			"type": "object",
			"additionalProperties": false,
			"description": "External reference IDs",
			"properties": {
				"wd": {"type": "string", "description": "Wikidata QID"},
				"viaf": {"type": "string", "description": "VIAF ID"},
				"imslp": {"type": "string", "description": "IMSLP composer page"},
				"wp": {"type": "string", "description": "Wikipedia article name"},
				"oo": {"type": "string", "description": "OpenOpus composer ID"},
				"mb": {"type": "string", "description": "MusicBrainz artist MBID"}
			}
		}
	},
	"$defs": {
		"catalogDefinition": {
			"type": "object",
			"additionalProperties": false,
			"required": ["name"],
			"properties": {
				"name": {"type": "string"},
				"description": {"type": "string"},
				"canonical_format": {"type": "string"},
				"part_format": {"type": "string", "description": "Display format for slash-delimited subordinate numbers, with {main} and {part} placeholders"},
				"pattern": {"type": "string"},
				"sort_keys": {
					"type": "array",
					"items": {"$ref": "#/$defs/sortKey"}
				},
				"group_by": {
					"type": "array",
					"items": {"type": "integer", "minimum": 1}
				},
				"examples": {
					"type": "array",
					"items": {"$ref": "#/$defs/example"}
				},
				"aliases": {
					"type": "array",
					"items": {"type": "string"}
				},
				"editions": {
					"type": "object",
					"additionalProperties": {"$ref": "#/$defs/edition"}
				},
				"current_edition": {
					"type": "string",
					"description": "Edition used when no edition is specified"
				},
				"categories": {
					"type": "object",
					"additionalProperties": {"type": "string"}
				},
				"constraints": {
					"type": "array",
					"items": {"$ref": "#/$defs/catalogConstraint"}
				},
				"primary": {"type": "boolean"},
				"mb_format": {"type": "string"},
				"mb_part_format": {"type": "string"}
			}
		},
		"sortKey": {
			"type": "object",
			"additionalProperties": false,
			"required": ["group", "type"],
			"properties": {
				"group": {"type": "integer", "minimum": 1},
				"type": {"type": "string", "enum": ["int", "str", "roman"]},
				"display": {"type": "string", "enum": ["upper", "lower", "title"]},
				"none_last": {"type": "boolean", "default": false}
			}
		},
		"example": {
			"type": "object",
			"additionalProperties": false,
			"required": ["number", "display"],
			"properties": {
				"number": {"type": "string"},
				"display": {"type": "string"}
			}
		},
		"catalogConstraint": {
			"type": "object",
			"additionalProperties": false,
			"required": ["group"],
			"properties": {
				"group": {"type": "integer", "minimum": 1},
				"name": {"type": "string"},
				"min": {"type": "integer"},
				"max": {"type": "integer"},
				"ranges": {
					"type": "array",
					"minItems": 1,
					"items": {"$ref": "#/$defs/intRange"}
				}
			}
		},
		"intRange": {
			"type": "object",
			"additionalProperties": false,
			"required": ["min", "max"],
			"properties": {
				"min": {"type": "integer"},
				"max": {"type": "integer"}
			}
		},
		"edition": {
			"type": "object",
			"additionalProperties": false,
			"required": ["year", "editor"],
			"properties": {
				"year": {"type": "integer"},
				"editor": {"type": "string"}
			}
		}
	}
}
