{
	"id": "beethoven",
	"name": {
		"full": "Ludwig van Beethoven",
		"sort": "Beethoven, Ludwig van"
	},
	"default_scheme": "op",
	"born": "1770-12-17",
	"died": "1827-03-26",
	"nationality": "Austrian",
	"catalogs": {
		"op": {
			"name": "Opus",
			"canonical_format": "op. {number}",
			"primary": true,
			"constraints": [
				{"group": 2, "name": "opus number", "min": 1, "max": 138}
			]
		},
		"woo": {
			"name": "Werke ohne Opuszahl",
			"canonical_format": "WoO {number}",
			"description": "Works without opus number, cataloged by Georg Kinsky and Hans Halm, 1955"
		}
	}
}
