{
	"id": "mozart",
	"name": {
		"full": "Wolfgang Amadeus Mozart",
		"sort": "Mozart, Wolfgang Amadeus"
	},
	"born": "1756-01-27",
	"died": "1791-12-05",
	"nationality": "Austrian",
	"catalogs": {
		"k": {
			"name": "Köchel-Verzeichnis",
			"description": "Standard Mozart catalog. Current numbers reflect K⁹ (2024). Historical number changes tracked in changelog.jsonl.",
			"canonical_format": "K. {number}",
			"pattern": "^(anh\\.)?\\s*([a-c])?\\s*(\\d+)(?:\\.(\\d+))?([a-z])?$",
			"sort_keys": [
				{"group": 1, "type": "str", "display": "title"},
				{"group": 2, "type": "str", "display": "upper"},
				{"group": 3, "type": "int"},
				{"group": 4, "type": "int"},
				{"group": 5, "type": "str"}
			],
			"examples": [
				{"number": "331", "display": "K. 331"},
				{"number": "300k", "display": "K. 300k"},
				{"number": "anh. a 54", "display": "K. Anh. A 54"}
			],
			"aliases": ["kv", "köchel"],
			"current_edition": "9",
			"editions": {
				"1": {"year": 1862, "editor": "Ludwig von Köchel"},
				"6": {"year": 1964, "editor": "Giegling, Weinmann, Sievers"},
				"9": {"year": 2024, "editor": "Neal Zaslaw"}
			}
		}
	}
}
